{
  "$schema": "https://json-schema.org/draft/2020-12/schema",
  "$id": "https://surfingdog.ai/spec/schemas/score-rules.json",
  "title": "GET /v1/score-rules: the agentic score's rules",
  "type": "object",
  "properties": {
    "version": {
      "type": "integer",
      "minimum": 1,
      "maximum": 9007199254740991
    },
    "name": {
      "type": "string"
    },
    "status": {
      "type": "string",
      "enum": ["in_force", "announced", "retired"]
    },
    "published_at": {
      "type": "string",
      "format": "date-time",
      "pattern": "^(?:(?:\\d\\d[2468][048]|\\d\\d[13579][26]|\\d\\d0[48]|[02468][048]00|[13579][26]00)-02-29|\\d{4}-(?:(?:0[13578]|1[02])-(?:0[1-9]|[12]\\d|3[01])|(?:0[469]|11)-(?:0[1-9]|[12]\\d|30)|(?:02)-(?:0[1-9]|1\\d|2[0-8])))T(?:(?:[01]\\d|2[0-3]):[0-5]\\d:[0-5]\\d(?:\\.\\d+)?(?:Z))$"
    },
    "effective_at": {
      "type": "string",
      "format": "date-time",
      "pattern": "^(?:(?:\\d\\d[2468][048]|\\d\\d[13579][26]|\\d\\d0[48]|[02468][048]00|[13579][26]00)-02-29|\\d{4}-(?:(?:0[13578]|1[02])-(?:0[1-9]|[12]\\d|3[01])|(?:0[469]|11)-(?:0[1-9]|[12]\\d|30)|(?:02)-(?:0[1-9]|1\\d|2[0-8])))T(?:(?:[01]\\d|2[0-3]):[0-5]\\d:[0-5]\\d(?:\\.\\d+)?(?:Z))$"
    },
    "summary": {
      "type": "string"
    },
    "vocabulary": {
      "type": "string"
    },
    "capabilities": {
      "type": "array",
      "items": {
        "type": "object",
        "properties": {
          "id": {
            "type": "string",
            "enum": [
              "find",
              "catalogue",
              "availability",
              "message",
              "negotiate",
              "book",
              "order",
              "signup",
              "pay",
              "change",
              "cancel",
              "track",
              "return",
              "receipt",
              "feedback",
              "subscription",
              "vouchers",
              "waitlist",
              "support",
              "policies"
            ]
          },
          "journey": {
            "type": "string",
            "enum": ["before", "doing", "after", "ongoing", "policies"]
          },
          "label": {
            "type": "string"
          },
          "question": {
            "type": "string"
          },
          "group": {
            "type": "string",
            "enum": ["core", "after", "state", "negotiate", "readable", "find", "unscored"]
          }
        },
        "required": ["id", "journey", "label", "question", "group"]
      }
    },
    "groups": {
      "type": "array",
      "items": {
        "type": "object",
        "properties": {
          "id": {
            "type": "string",
            "enum": ["core", "after", "state", "negotiate", "readable", "find", "unscored"]
          },
          "weight": {
            "type": "integer",
            "minimum": 0,
            "maximum": 100
          },
          "members": {
            "type": "array",
            "items": {
              "type": "string",
              "enum": [
                "find",
                "catalogue",
                "availability",
                "message",
                "negotiate",
                "book",
                "order",
                "signup",
                "pay",
                "change",
                "cancel",
                "track",
                "return",
                "receipt",
                "feedback",
                "subscription",
                "vouchers",
                "waitlist",
                "support",
                "policies"
              ]
            }
          }
        },
        "required": ["id", "weight", "members"]
      }
    },
    "profiles": {
      "type": "array",
      "items": {
        "type": "object",
        "properties": {
          "id": {
            "type": "string",
            "enum": ["appointments", "classes", "food", "trades", "shop", "stay", "memberships", "venues", "general"]
          },
          "label": {
            "type": "string"
          },
          "noun": {
            "type": "string",
            "description": "What \"scored as\" says: \"a shop\"."
          },
          "applicable": {
            "type": "array",
            "items": {
              "type": "string",
              "enum": [
                "find",
                "catalogue",
                "availability",
                "message",
                "negotiate",
                "book",
                "order",
                "signup",
                "pay",
                "change",
                "cancel",
                "track",
                "return",
                "receipt",
                "feedback",
                "subscription",
                "vouchers",
                "waitlist",
                "support",
                "policies"
              ]
            }
          },
          "either": {
            "description": "Version 2: sets of applicable capabilities of one group that count as one member of it, met by the best state any of them has (book, order or sign up, for a business of a kind not known).",
            "type": "array",
            "items": {
              "minItems": 2,
              "type": "array",
              "items": {
                "type": "string",
                "enum": [
                  "find",
                  "catalogue",
                  "availability",
                  "message",
                  "negotiate",
                  "book",
                  "order",
                  "signup",
                  "pay",
                  "change",
                  "cancel",
                  "track",
                  "return",
                  "receipt",
                  "feedback",
                  "subscription",
                  "vouchers",
                  "waitlist",
                  "support",
                  "policies"
                ]
              }
            }
          },
          "groups": {
            "type": "array",
            "items": {
              "type": "string"
            },
            "description": "The directory's category groups this profile covers."
          }
        },
        "required": ["id", "label", "noun", "applicable", "groups"]
      }
    },
    "follows": {
      "description": "Version 2 as amended on 8 October 2026: when `if` applies to a business's profile and is yes or partial, the capabilities it `adds` count for it too (where an agent can book, changing and cancelling the booking count).",
      "type": "array",
      "items": {
        "type": "object",
        "properties": {
          "if": {
            "type": "string",
            "enum": [
              "find",
              "catalogue",
              "availability",
              "message",
              "negotiate",
              "book",
              "order",
              "signup",
              "pay",
              "change",
              "cancel",
              "track",
              "return",
              "receipt",
              "feedback",
              "subscription",
              "vouchers",
              "waitlist",
              "support",
              "policies"
            ]
          },
          "adds": {
            "minItems": 1,
            "type": "array",
            "items": {
              "type": "string",
              "enum": [
                "find",
                "catalogue",
                "availability",
                "message",
                "negotiate",
                "book",
                "order",
                "signup",
                "pay",
                "change",
                "cancel",
                "track",
                "return",
                "receipt",
                "feedback",
                "subscription",
                "vouchers",
                "waitlist",
                "support",
                "policies"
              ]
            }
          },
          "goods": {
            "description": "Only for a business that sells goods (`goods`).",
            "type": "boolean"
          }
        },
        "required": ["if", "adds"]
      }
    },
    "goods": {
      "description": "Who sells goods, for a follow marked `goods`: a business of one of `profiles`, or one whose signals say so (a live checkout door, a catalogue of products) and whose profile is not one of `never`.",
      "type": "object",
      "properties": {
        "summary": {
          "type": "string"
        },
        "profiles": {
          "type": "array",
          "items": {
            "type": "string",
            "enum": ["appointments", "classes", "food", "trades", "shop", "stay", "memberships", "venues", "general"]
          },
          "description": "Profiles whose businesses sell goods by their kind."
        },
        "never": {
          "type": "array",
          "items": {
            "type": "string",
            "enum": ["appointments", "classes", "food", "trades", "shop", "stay", "memberships", "venues", "general"]
          },
          "description": "Profiles whose businesses never do, whatever their signals."
        }
      },
      "required": ["summary", "profiles", "never"]
    },
    "credit": {
      "type": "object",
      "properties": {
        "yes": {
          "type": "number"
        },
        "partial": {
          "type": "number"
        },
        "no": {
          "type": "number"
        }
      },
      "required": ["yes", "partial", "no"]
    },
    "requests": {
      "description": "Version 2 as amended on 12 October 2026: a request an agent files to change, cancel or return something, with a reference it can follow to the answer, counts as yes, the same as a door that carries it out at once.",
      "type": "string"
    },
    "evidence": {
      "type": "object",
      "properties": {
        "declared": {
          "type": "number"
        },
        "tested": {
          "type": "number"
        },
        "proven": {
          "type": "number"
        },
        "produced": {
          "type": "array",
          "items": {
            "type": "string",
            "enum": ["declared", "tested", "proven"]
          }
        }
      },
      "required": ["declared", "tested", "proven", "produced"]
    },
    "formula": {
      "type": "string"
    },
    "grades": {
      "type": "array",
      "items": {
        "type": "object",
        "properties": {
          "grade": {
            "type": "string",
            "enum": ["A", "B", "C", "D", "E"]
          },
          "min": {
            "type": "integer",
            "minimum": 0,
            "maximum": 100
          }
        },
        "required": ["grade", "min"]
      }
    },
    "rank": {
      "type": "string"
    },
    "named": {
      "type": "string"
    },
    "directory": {
      "type": "string"
    },
    "not_certification": {
      "type": "string"
    },
    "fixes": {
      "type": "object",
      "propertyNames": {
        "type": "string",
        "enum": [
          "find",
          "catalogue",
          "availability",
          "message",
          "negotiate",
          "book",
          "order",
          "signup",
          "pay",
          "change",
          "cancel",
          "track",
          "return",
          "receipt",
          "feedback",
          "subscription",
          "vouchers",
          "waitlist",
          "support",
          "policies"
        ]
      },
      "additionalProperties": {
        "type": "object",
        "properties": {
          "title": {
            "type": "string"
          },
          "how": {
            "type": "string",
            "description": "\"<door>\" stands for \" on your <door label> door at <url>\" when the business has a live agent door."
          },
          "by_profile": {
            "description": "Another how, and title, for a kind of business.",
            "type": "object",
            "propertyNames": {
              "type": "string",
              "enum": ["appointments", "classes", "food", "trades", "shop", "stay", "memberships", "venues", "general"]
            },
            "additionalProperties": {
              "type": "object",
              "properties": {
                "title": {
                  "description": "Another title for a kind of business.",
                  "type": "string"
                },
                "how": {
                  "type": "string",
                  "description": "\"<door>\" stands for \" on your <door label> door at <url>\" when the business has a live agent door."
                }
              },
              "required": ["how"]
            }
          },
          "protocol": {
            "description": "The how when the business's preferred door is an agent commerce protocol (UCP, ACP).",
            "type": "string"
          }
        },
        "required": ["title", "how"]
      }
    },
    "changelog": {
      "type": "array",
      "items": {
        "type": "object",
        "properties": {
          "version": {
            "type": "integer",
            "minimum": 1,
            "maximum": 9007199254740991
          },
          "published": {
            "description": "The day a version was published.",
            "type": "string",
            "format": "date",
            "pattern": "^(?:(?:\\d\\d[2468][048]|\\d\\d[13579][26]|\\d\\d0[48]|[02468][048]00|[13579][26]00)-02-29|\\d{4}-(?:(?:0[13578]|1[02])-(?:0[1-9]|[12]\\d|3[01])|(?:0[469]|11)-(?:0[1-9]|[12]\\d|30)|(?:02)-(?:0[1-9]|1\\d|2[0-8])))$"
          },
          "amended": {
            "description": "The day a version was amended without a new number.",
            "type": "string",
            "format": "date",
            "pattern": "^(?:(?:\\d\\d[2468][048]|\\d\\d[13579][26]|\\d\\d0[48]|[02468][048]00|[13579][26]00)-02-29|\\d{4}-(?:(?:0[13578]|1[02])-(?:0[1-9]|[12]\\d|3[01])|(?:0[469]|11)-(?:0[1-9]|[12]\\d|30)|(?:02)-(?:0[1-9]|1\\d|2[0-8])))$"
          },
          "summary": {
            "type": "string"
          }
        },
        "required": ["version", "summary"]
      }
    }
  },
  "required": [
    "version",
    "name",
    "status",
    "published_at",
    "effective_at",
    "summary",
    "vocabulary",
    "capabilities",
    "groups",
    "profiles",
    "credit",
    "evidence",
    "formula",
    "grades",
    "rank",
    "named",
    "directory",
    "not_certification",
    "fixes",
    "changelog"
  ]
}
