{
  "version": 2,
  "name": "Agentic score",
  "status": "in_force",
  "published_at": "2026-10-07T00:00:00Z",
  "effective_at": "2026-10-07T00:00:00Z",
  "summary": "The agentic score says how far an AI agent can go with a business through doors the business published: message, book, order, sign up, cancel and negotiate, and the journey around them. It counts what applies to that kind of business, and what follows from what an agent can do there (where it can book, order or sign up, changing and cancelling that too, and the other steps after it), and nothing else, by the weights below, from what we read on the business's own site and doors, each with its source and date. It is not a certification, it never changes the directory's search order, and nobody can pay for it.",
  "vocabulary": "https://surfingdog.ai/v1/score-rules#capabilities",
  "capabilities": [
    {
      "id": "find",
      "journey": "before",
      "label": "Find",
      "question": "Can an agent read who the business is, its opening hours and where it is?",
      "group": "find"
    },
    {
      "id": "catalogue",
      "journey": "before",
      "label": "Catalogue",
      "question": "Can an agent read its services, products or menu, with prices?",
      "group": "readable"
    },
    {
      "id": "availability",
      "journey": "before",
      "label": "Availability",
      "question": "Can an agent check free slots or stock?",
      "group": "state"
    },
    {
      "id": "message",
      "journey": "before",
      "label": "Message",
      "question": "Can an agent send the business a message and get an answer?",
      "group": "core"
    },
    {
      "id": "negotiate",
      "journey": "before",
      "label": "Negotiate",
      "question": "Can an agent ask for a quote, make an offer or get a counter-offer?",
      "group": "negotiate"
    },
    {
      "id": "book",
      "journey": "doing",
      "label": "Book",
      "question": "Can an agent make a booking, with its details?",
      "group": "core"
    },
    {
      "id": "order",
      "journey": "doing",
      "label": "Order",
      "question": "Can an agent place an order, with its options?",
      "group": "core"
    },
    {
      "id": "signup",
      "journey": "doing",
      "label": "Sign up",
      "question": "Can an agent sign the person up: an account, a membership, a class, a course or a newsletter list for the business's own service?",
      "group": "core"
    },
    {
      "id": "pay",
      "journey": "doing",
      "label": "Pay",
      "question": "Can an agent pay, and is it clear how payment happens?",
      "group": "core"
    },
    {
      "id": "change",
      "journey": "after",
      "label": "Change",
      "question": "Can an agent change a booking or an order?",
      "group": "after"
    },
    {
      "id": "cancel",
      "journey": "after",
      "label": "Cancel",
      "question": "Can an agent cancel a booking or an order?",
      "group": "after"
    },
    {
      "id": "track",
      "journey": "after",
      "label": "Track",
      "question": "Can an agent see the status of a booking, an order or a delivery?",
      "group": "state"
    },
    {
      "id": "return",
      "journey": "after",
      "label": "Return or refund",
      "question": "Can an agent start a return, a refund or an exchange?",
      "group": "after"
    },
    {
      "id": "receipt",
      "journey": "after",
      "label": "Receipt",
      "question": "Can an agent get a receipt or an invoice?",
      "group": "after"
    },
    {
      "id": "feedback",
      "journey": "after",
      "label": "Feedback",
      "question": "Can an agent leave feedback or a review?",
      "group": "unscored"
    },
    {
      "id": "subscription",
      "journey": "ongoing",
      "label": "Membership",
      "question": "Can an agent pause, resume or end a membership or subscription?",
      "group": "after"
    },
    {
      "id": "vouchers",
      "journey": "ongoing",
      "label": "Vouchers",
      "question": "Can an agent use a gift card, a voucher or loyalty points?",
      "group": "unscored"
    },
    {
      "id": "waitlist",
      "journey": "ongoing",
      "label": "Waitlist",
      "question": "Can an agent join a waitlist?",
      "group": "unscored"
    },
    {
      "id": "support",
      "journey": "ongoing",
      "label": "Support",
      "question": "Can an agent raise a complaint or a problem with an order?",
      "group": "unscored"
    },
    {
      "id": "policies",
      "journey": "policies",
      "label": "Policies",
      "question": "Can an agent read the cancellation, return, deposit or no-show policy?",
      "group": "readable"
    }
  ],
  "groups": [
    {
      "id": "core",
      "weight": 40,
      "members": ["message", "book", "order", "signup", "pay"]
    },
    {
      "id": "after",
      "weight": 30,
      "members": ["change", "cancel", "return", "subscription", "receipt"]
    },
    {
      "id": "state",
      "weight": 10,
      "members": ["availability", "track"]
    },
    {
      "id": "negotiate",
      "weight": 5,
      "members": ["negotiate"]
    },
    {
      "id": "readable",
      "weight": 10,
      "members": ["catalogue", "policies"]
    },
    {
      "id": "find",
      "weight": 5,
      "members": ["find"]
    },
    {
      "id": "unscored",
      "weight": 0,
      "members": ["feedback", "vouchers", "waitlist", "support"]
    }
  ],
  "profiles": [
    {
      "id": "appointments",
      "label": "Appointments (salons, clinics, lawyers, advisers, tours)",
      "noun": "a business taking appointments (a salon, a clinic, a dentist, a lawyer, an adviser or a tour)",
      "applicable": [
        "find",
        "catalogue",
        "availability",
        "message",
        "book",
        "pay",
        "change",
        "cancel",
        "feedback",
        "policies"
      ],
      "groups": [
        "hair-beauty",
        "wellness",
        "photography",
        "tours",
        "auto",
        "health",
        "dental",
        "therapy",
        "legal",
        "accounting",
        "finance",
        "property",
        "recruitment"
      ]
    },
    {
      "id": "classes",
      "label": "Classes, lessons, tutoring and childcare",
      "noun": "a school, a class, a tutor or childcare (lessons, courses, tutoring and day care)",
      "applicable": [
        "find",
        "catalogue",
        "availability",
        "message",
        "book",
        "signup",
        "pay",
        "change",
        "cancel",
        "feedback",
        "policies"
      ],
      "either": [["book", "signup"]],
      "groups": ["education", "childcare"]
    },
    {
      "id": "food",
      "label": "Restaurants, bars and food",
      "noun": "a restaurant, a bar or a food business",
      "applicable": ["find", "catalogue", "availability", "message", "book", "order", "pay", "change", "cancel"],
      "groups": ["restaurant", "cafe", "bakery", "bar"]
    },
    {
      "id": "trades",
      "label": "Trades and quote-led services",
      "noun": "a trade or quote-led service",
      "applicable": ["message", "negotiate", "book", "pay", "change", "cancel", "receipt"],
      "groups": ["trades", "cleaning", "repair", "consulting", "it-services", "events"]
    },
    {
      "id": "shop",
      "label": "Shops",
      "noun": "a shop",
      "applicable": [
        "find",
        "catalogue",
        "availability",
        "message",
        "order",
        "pay",
        "change",
        "cancel",
        "track",
        "return",
        "receipt"
      ],
      "groups": ["grocery", "shop", "florist", "pets", "crafts"]
    },
    {
      "id": "stay",
      "label": "Places to stay and transport",
      "noun": "a place to stay, or transport (an airline, a ferry, a coach or a taxi)",
      "applicable": ["availability", "message", "book", "pay", "change", "cancel", "policies"],
      "groups": ["stay", "transport"]
    },
    {
      "id": "memberships",
      "label": "Gyms and memberships",
      "noun": "a gym or membership business",
      "applicable": ["find", "catalogue", "message", "book", "order", "signup", "pay", "cancel", "subscription"],
      "either": [["order", "signup"]],
      "groups": ["fitness"]
    },
    {
      "id": "venues",
      "label": "Venues and events (live music, clubs, theatre, cinema, museums)",
      "noun": "a venue (live music, a club, a theatre, a cinema, a museum or an event space)",
      "applicable": [
        "find",
        "catalogue",
        "availability",
        "message",
        "book",
        "order",
        "signup",
        "pay",
        "change",
        "cancel",
        "policies"
      ],
      "either": [["book", "order", "signup"]],
      "groups": ["venues"]
    },
    {
      "id": "general",
      "label": "Business (type unknown)",
      "noun": "a business of a kind not known",
      "applicable": ["find", "catalogue", "message", "book", "order", "signup", "pay", "policies"],
      "either": [["book", "order", "signup"]],
      "groups": ["software-ai"]
    }
  ],
  "follows": [
    {
      "if": "order",
      "adds": ["change", "cancel", "track", "receipt"]
    },
    {
      "if": "order",
      "adds": ["return"],
      "goods": true
    },
    {
      "if": "book",
      "adds": ["change", "cancel", "availability"]
    },
    {
      "if": "signup",
      "adds": ["change", "cancel", "subscription"]
    }
  ],
  "goods": {
    "summary": "A business sells goods when it is scored as a shop, or when it has a live UCP, ACP or Shopify checkout door or a catalogue of at least three products, unless it is a restaurant, a bar or a food business: a takeaway is not returned.",
    "profiles": ["shop"],
    "never": ["food"]
  },
  "credit": {
    "yes": 1,
    "partial": 0.5,
    "no": 0
  },
  "evidence": {
    "declared": 1,
    "tested": 1,
    "proven": 1,
    "produced": ["declared"]
  },